<?xml version="1.0" encoding="UTF-8"?>
<xs:schema xmlns:xs="http://www.w3.org/2001/XMLSchema">

    <xs:element name="hr">
        <!--complexType-复杂节点，包含子节点时必须使用这个标签-->
        <xs:complexType>
            <xs:sequence>
                <xs:element name="employee" minOccurs="1" maxOccurs="unbounded">
                    <xs:complexType>
                        <xs:sequence>
                            <xs:element name="name" type="xs:string"></xs:element>
                            <xs:element name="age">
                             <xs:simpleType>
                                 <xs:restriction base="xs:integer">
                                     <xs:minInclusive value="18"/>
                                     <xs:maxInclusive value="60"/>
                                 </xs:restriction>
                             </xs:simpleType>
                            </xs:element>
                            <xs:element name="salary" type="xs:integer"></xs:element>
                        </xs:sequence>
                        <xs:attribute name="no" type="xs:string" use="required"></xs:attribute>
                    </xs:complexType>
                </xs:element>
            </xs:sequence>
        </xs:complexType>
    </xs:element>

</xs:schema>