<?xml version="1.0" encoding="UTF-8"?>
<hr xmlns:xsi="http://www.w3.org/2001/XMLSchema-instance" xsi:noNamespaceSchemaLocation="test.xsd">
    <employee no="1111">
        <name>ddd</name>
        <age>45</age>
        <salary>999</salary>
    </employee>
    <employee no="3311">
        <name>莉莉</name>
        <age>17</age>
        <salary>3600</salary>
    </employee>
</hr>